name,description,createdAt,usageCount,isOfficial
Discussion,Suggest address debate watch recently.,2026-01-09,2794,true
Meme,Exist article future black purpose body.,2025-05-18,2036,true
News,Mind authority might.,2025-03-11,4417,true
Guide,Daughter discover recognize ago agency base determine.,2025-08-06,8713,true
Spoiler,Miss remain front last.,2025-05-04,3191,false
Fanart,Analysis arrive wind history use fly.,2026-01-14,5052,false
Question,Fly admit Congress player bring social modern.,2024-09-20,4265,true
LFG,Make chair game must also.,2025-03-23,9501,false
Review,Nice water carry.,2024-08-03,7719,true
Esports,Evening carry wear.,2025-09-03,4080,true
Rumor,Paper today large.,2024-09-22,6159,true
